project,experiment,iteration,stim_id,gameID,condition,startInstructionTS,startPracticeTS,startPreTS,startMainTS,startPostTS,startSurveyTS,startComprehensionTS,endExperimentTS,participantExplanations,judgedDifficulty,participantEffort,sokobanFamiliarity,gamingFrequency,participantYears,participantGender,participantRace,participantEthnicity,inputDevice,technicalDifficultiesComments,participantRace-Comment,inputDevice-Comment
fun-puzzles,fun-puzzles-exp1,production2,6790956f96019241f9c4f665,3940-a6a959f6-2dc0-43d7-9f8e-e5e5d3cfc436,difficult,1737698930254.0,1737699002179.0,1737699269487.0,1737699303195.0,1737701085836.0,1737701114538.0,1737699028064.0,1737701114538.0,The amount of time and effort it took to figure out the task.,4,5,0,4,23,Female,['White'],Non-Hispanic,['Trackpad'],"When I pressed the reset or go back button, I would have to click back into the game screen.",,
fun-puzzles,fun-puzzles-exp1,production2,6790956f96019241f9c4f664,4638-717aec54-5d36-49f1-8eee-4ed826fd21d6,difficult,1737698273064.0,1737699389422.0,1737700449949.0,1737700540663.0,1737703286770.0,1737703319860.0,1737699435756.0,1737703319861.0,The complexity of solving the puzzle itself and ease of finding your way to the sand,4,5,1,1,52,Male,['White'],Non-Hispanic,['none'],The study was fun and interesting,,
fun-puzzles,fun-puzzles-exp1,production2,6790956f96019241f9c4f666,7209-f522767f-26aa-4a22-b50a-17f64304a083,difficult,1737713128777.0,1737713203923.0,1737713520425.0,1737713664522.0,1737715507326.0,1737715537688.0,1737713230694.0,1737715537688.0,"I pretty much rated them on how long it took me to solve the puzzles, but they was also some times that after discovering the trick to completing it, it kinda looked simple to do. Also i took into account how many resets and undos i used on the puzzle.",3,5,1,4,29,Male,['White'],Non-Hispanic,['none'],,,
fun-puzzles,fun-puzzles-exp1,production2,6790956f96019241f9c4f66c,4733-c6a6e973-18d8-4b07-9e81-737cf6b3fe7b,difficult,1737713248200.0,1737713303799.0,1737713603712.0,1737713665124.0,1737715636979.0,1737715663200.0,1737713330582.0,1737715663201.0,The biggest thing was if I actually managed to finish the puzzle in 5 minutes or not. A lot of them I tried what felt like every combination of moves and the puzzle felt almost impossible to solve which is why it was scored much higher. Anything low was because I managed to solve it with ease/quickly.,4,5,2,2,24,Female,['White'],Non-Hispanic,['none'],,,
fun-puzzles,fun-puzzles-exp1,production2,6790956f96019241f9c4f667,6110-7c3fd621-28f8-4d65-b650-9c8fcc6290c8,difficult,1737713145146.0,1737713227594.0,1737713475437.0,1737713538379.0,1737715831399.0,1737715860431.0,1737713254639.0,1737715860432.0,"How easy it was to solve, how much effort the solution was",3,5,0,2,39,Female,['White'],Non-Hispanic,['none'],none,,
fun-puzzles,fun-puzzles-exp1,production2,6790956f96019241f9c4f668,0047-f873669a-075a-4f22-80d2-c33cd8217451,difficult,1737713173179.0,1737713307640.0,1737713582523.0,1737713620484.0,1737715996874.0,1737716027845.0,1737713341619.0,1737716027846.0,The only factor was whether I could complete it or not. If I was close to the solution when the time ran out or if I thought it was possible with a longer time or just impossible even with an eternity to try. Most were VERY difficult. Well done,5,5,0,2,53,Female,['White'],Non-Hispanic,['none'],No issues. This study wins a prize for being so cute but also so hard,,
fun-puzzles,fun-puzzles-exp1,production2,6790956f96019241f9c4f669,2839-a3cd9207-4f4c-4db0-a0db-5d16fa3e57ac,difficult,1737713166383.0,1737713256009.0,1737713545573.0,1737713578460.0,1737716210180.0,1737716235250.0,1737713356414.0,1737716235250.0,"whether I was able to complete the puzzle, if I could figure out the steps needed",5,5,0,1,26,Female,['White'],Non-Hispanic,['none'],,,
fun-puzzles,fun-puzzles-exp1,production2,6790956f96019241f9c4f66b,9390-86c56e18-f87b-46d4-9a5e-f44e363d8f6c,difficult,1737713242811.0,1737713415082.0,1737713898264.0,1737713946352.0,1737716518862.0,1737716569207.0,1737713516329.0,1737716569208.0,understanding,4,5,0,1,26,Female,['Black/African American'],Non-Hispanic,['none'],none,,
fun-puzzles,fun-puzzles-exp1,production2,6790956f96019241f9c4f66a,4874-8b3ae495-d2ac-48be-9f34-6a6c65fb844f,difficult,1737713350365.0,1737713563855.0,1737713973212.0,1737714026562.0,1737716487541.0,1737716537378.0,1737713597074.0,1737716537379.0,"An average of 7 for me, it was difficult. I'm really ashamed of myself for barely solving half and i know fully well someone somewhere solved the whole thing. factors that affected my ratings, well my performance.",4,4,2,4,24,Male,['Black/African American'],Non-Hispanic,['none'],"This was a great study and an eye opener, i really need to work on my mind and mental well being.",,
fun-puzzles,fun-puzzles-exp1,production2,6790956f96019241f9c4f66e,8548-f432b403-c1b9-4c23-b610-38229bfe78ab,difficult,1737713524552.0,1737713999294.0,1737714901043.0,1737715004893.0,1737718101961.0,1737718154943.0,1737714035140.0,1737718154944.0,how easy it is to solve the puzzle,5,5,1,2,57,Female,['Black/African American'],Non-Hispanic,['none'],the puzzle was extremely  hard ,,
fun-puzzles,fun-puzzles-exp1,production2,6790956f96019241f9c4f677,8941-a75295a1-0952-400a-98d3-689ad17d5fd6,enjoyable,1737737625187.0,1737737685415.0,1737737891255.0,1737737918782.0,1737739661832.0,1737739687302.0,1737737708524.0,1737739687302.0,7 the level of difficulty,3,5,1,0,38,Female,['White'],Non-Hispanic,['none'],i had no issues,,
fun-puzzles,fun-puzzles-exp1,production2,6790956f96019241f9c4f671,3398-8fd61e31-c1ca-4273-94c4-fcce5e1b8ca2,difficult,1737737612154.0,1737737752187.0,1737738029269.0,1737738068367.0,1737739555054.0,1737739586377.0,1737737777270.0,1737739586378.0,Whether I could complete the puzzle and if so how long it took me. Also factored in how much luck I felt played a part in me solving the puzzle.,3,5,0,2,26,Female,['White'],Non-Hispanic,['none'],,,
fun-puzzles,fun-puzzles-exp1,production2,6790956f96019241f9c4f680,5808-784eccb3-6c57-47b0-b644-b30e7354513c,enjoyable,1737737672797.0,1737737774103.0,1737738054018.0,1737738116582.0,1737740135435.0,1737740173723.0,1737737806537.0,1737740173724.0,The main factor was if I thought it was beatable.  I don't enjoy doing unsolvable puzzles.,2,5,1,3,42,Female,['White'],Non-Hispanic,['none'],,,
fun-puzzles,fun-puzzles-exp1,production2,6790957096019241f9c4f689,9929-112c5ca1-1f34-42cb-b380-2ddd456ce48e,enjoyable,1737737722229.0,1737737774404.0,1737738020903.0,1737738045764.0,1737740160330.0,1737740184778.0,1737737787402.0,1737740184778.0,10. The more difficulty i had the more I enjoyed them.,3,5,0,4,21,Male,['Prefer not to answer'],Hispanic,['none'],,,
fun-puzzles,fun-puzzles-exp1,production2,6790956f96019241f9c4f675,0808-1234c64f-ccf4-46a1-bc6f-6827478f2d8e,difficult,1737737984912.0,1737738086869.0,1737738367444.0,1737738401401.0,1737740718158.0,1737740751620.0,1737738130745.0,1737740751622.0,"I found a lot of the puzzles really really difficult, I tried really hard to complete them but most of them I just couldnt figure out.",5,5,0,2,23,Female,['White'],Non-Hispanic,['Trackpad'],,,
fun-puzzles,fun-puzzles-exp1,production2,6790956f96019241f9c4f679,5158-d99f7eab-0aa9-4d14-be5b-5d7b30250881,enjoyable,1737737647911.0,1737737784845.0,1737738034659.0,1737738063638.0,1737740415886.0,1737740452376.0,1737737798503.0,1737740452377.0,the way it engages my brain activity,2,5,0,2,50,Female,"['Black/African American', 'other']",Non-Hispanic,['none'],I really enjoyed the game and would play it again if I come across it as it engages brain activity very well.,Black/british,
fun-puzzles,fun-puzzles-exp1,production2,6790956f96019241f9c4f66f,9875-77c31433-07e1-4aef-a4e5-043f15ecb034,difficult,1737737590840.0,1737737705278.0,1737738035190.0,1737738071167.0,1737740548448.0,1737740604834.0,1737737753994.0,1737740604836.0,The size of the board and how many corners and one way exits,4,5,0,2,41,Female,['White'],Non-Hispanic,['none'],,,
fun-puzzles,fun-puzzles-exp1,production2,6790956f96019241f9c4f674,6186-32e70ee4-7ac6-4d03-856c-c7e9ef8aba13,difficult,1737737624176.0,1737737729747.0,1737738073879.0,1737738113281.0,1737740467788.0,1737740504348.0,1737737759875.0,1737740504349.0,"If I couldn't complete it or it appeared impossible (even though it probably wasn't) it would get a 9 or 10. The ability to move the gems around was a factor, sometimes I could see no way to arrange them correctly.",4,5,0,4,46,Male,['White'],Non-Hispanic,['none'],"The game seemed to use a lot of resources, but it didn't effect the experiment.",,
fun-puzzles,fun-puzzles-exp1,production2,6790956f96019241f9c4f676,0209-82f8d7b1-7d8c-421b-becd-e2fc43eb28b8,difficult,1737737798094.0,1737737883348.0,1737738227962.0,1737738282721.0,1737740948263.0,1737740985297.0,1737737956542.0,1737740985298.0,whether or not i could complete the puzzles and how long it took,4,4,1,1,20,Male,['White'],Non-Hispanic,['none'],,,
fun-puzzles,fun-puzzles-exp1,production2,6790957096019241f9c4f687,8829-549a72ed-1db2-424f-ba1f-171c5a187085,enjoyable,1737737764697.0,1737737910396.0,1737738241378.0,1737738275025.0,1737740788112.0,1737740831227.0,1737737972300.0,1737740831228.0,I thought about whether the puzzles were solvable or not,4,4,3,4,22,Male,['Black/African American'],Non-Hispanic,['none'],No trouble,,
fun-puzzles,fun-puzzles-exp1,production2,6790956f96019241f9c4f670,3592-7763f518-8340-496a-83e4-72958bed2b0a,difficult,1737738083705.0,1737738230914.0,1737738557963.0,1737738608826.0,1737740842502.0,1737740868349.0,1737738326932.0,1737740868350.0,"I scanned the puzzled in turn to see how it would go if I made a number of moves, if I could see a pathway",3,5,0,0,56,Male,['White'],Non-Hispanic,['none'],,,
fun-puzzles,fun-puzzles-exp1,production2,6790956f96019241f9c4f663,4221-f8153973-98d6-43e5-9908-2a60cadfb458,difficult,1737737571543.0,1737737774579.0,1737738112719.0,1737738160493.0,1737740820950.0,1737740853062.0,1737737822240.0,1737740853064.0,The ratings were determined by the effectiveness of completing the puzzles.  I was only able to complete one puzzle so I rated it lower in difficulty.,5,5,0,0,46,Male,['White'],Non-Hispanic,['none'],,,
fun-puzzles,fun-puzzles-exp1,production2,6790957096019241f9c4f692,4320-9a92a33e-6a72-478a-9973-6d8da20dea70,difficult,1737737843556.0,1737737926363.0,1737738316827.0,1737738389865.0,1737740898242.0,1737740929517.0,1737737960420.0,1737740929518.0,10,4,5,3,1,42,Male,['White'],Non-Hispanic,['none'],,,
fun-puzzles,fun-puzzles-exp1,production2,6790957096019241f9c4f68b,4896-b66aacea-64dd-49d3-a2ef-7ab7dcb4dd82,difficult,1737737785839.0,1737737932625.0,1737738288780.0,1737738320630.0,1737740979527.0,1737741008492.0,1737738050821.0,1737741008493.0,"10, Was not able to solve any",5,4,0,0,40,Female,['Asian'],Non-Hispanic,['none'],too long and fustrating towards the end,,
fun-puzzles,fun-puzzles-exp1,production2,6790957096019241f9c4f68c,4716-1b2723d0-ff1a-41ed-8ea9-bceb42bd14ce,difficult,1737737784339.0,1737737943516.0,1737738233892.0,1737738281844.0,1737741011600.0,1737741040442.0,1737737969423.0,1737741040443.0,"factors affecting my rating were, the amount of time it would take to complete a puzzle and how frequent is the occurrence of obstacles ",5,5,0,2,23,Female,['Black/African American'],Non-Hispanic,['Trackpad'],i did not encounter any issues with the study.,,
fun-puzzles,fun-puzzles-exp1,production2,6790957096019241f9c4f694,1596-edd316b7-6662-437d-b77f-fe95f4e07675,difficult,1737738043720.0,1737738274312.0,1737738658584.0,1737738700472.0,1737741191386.0,1737741228952.0,1737738373738.0,1737741228953.0,ablity to complete it,5,5,1,2,49,Male,['Black/African American'],Non-Hispanic,"['Trackpad', 'Touch Screen']",no,,
fun-puzzles,fun-puzzles-exp1,production2,6790957096019241f9c4f693,8498-7e0986a7-3f38-4667-9b8d-ca68dbbbee16,difficult,1737738026397.0,1737738169681.0,1737738465797.0,1737738532354.0,1737741219703.0,1737741246690.0,1737738205940.0,1737741246691.0,Some seemed impossible to solve.,5,5,0,2,51,Male,['American Indian/Alaska Native'],Non-Hispanic,['none'],This was incredibly frustrating.,,
fun-puzzles,fun-puzzles-exp1,production2,6790956f96019241f9c4f67d,9452-adc2ff0b-2602-4162-a90b-ba6db4c203ce,enjoyable,1737737694342.0,1737737888523.0,1737738264407.0,1737738310846.0,1737741079650.0,1737741123059.0,1737737943600.0,1737741123059.0,"Some puzzles were challenging to solve, which made them frustrating. The easier and more creative ones were much more enjoyable.",3,5,0,0,34,Male,['White'],Non-Hispanic,['Trackpad'],Everthing went well. ,,
fun-puzzles,fun-puzzles-exp1,production2,6790957096019241f9c4f68f,5653-dfcb6dfa-3014-4033-875d-85592e44c67c,difficult,1737737838959.0,1737738165101.0,1737738494331.0,1737738532734.0,1737741258247.0,1737741292566.0,1737738235805.0,1737741292567.0,Thinking maybe I almost had it right before time ran out then figuring out its impossible,4,5,0,3,46,Female,['White'],Prefer not to answer,['Trackpad'],no,,
fun-puzzles,fun-puzzles-exp1,production2,6790957096019241f9c4f695,5829-72ec2758-b054-405d-84af-93958e222f07,difficult,1737738014703.0,1737738055069.0,1737738496742.0,1737738553214.0,1737741555179.0,1737741597660.0,1737738138785.0,1737741597662.0,The puzzles engages the mind alot and is interesting,4,5,2,3,38,Male,['Black/African American'],Prefer not to answer,['none'],I did not encounter any,,
fun-puzzles,fun-puzzles-exp1,production2,6790956f96019241f9c4f682,9700-3f1fa752-1627-427b-862c-3c37ccdd3eab,enjoyable,1737737744275.0,1737737875953.0,1737738539052.0,1737738662151.0,1737741829275.0,1737741855190.0,1737738245495.0,1737741855191.0,the puzzles were very hard,5,5,2,3,20,Female,['Black/African American'],Non-Hispanic,['none'],,,
fun-puzzles,fun-puzzles-exp1,production2,6790957096019241f9c4f690,1642-61ad1944-5d43-48a6-a027-842ccbac7568,difficult,1737737957553.0,1737738152957.0,1737738606877.0,1737738698741.0,1737741598425.0,1737741636036.0,1737738222104.0,1737741636039.0,"Time
Range of numbers",2,5,2,3,19,Female,['other'],Non-Hispanic,['none'],,Black Caribbean,
fun-puzzles,fun-puzzles-exp1,production2,6790956f96019241f9c4f673,8970-248ef224-45f0-409b-b3f9-00ecd37777f1,difficult,1737737612974.0,1737737800549.0,1737738255636.0,1737738316001.0,1737742057174.0,1737742088947.0,1737737862453.0,1737742088948.0,My ability to move freely and how hard I had to think before moving the treasures,5,5,0,3,27,Male,['Black/African American'],Non-Hispanic,['none'],No,,
fun-puzzles,fun-puzzles-exp1,production2,6790957096019241f9c4f691,7096-1cf9f68d-8231-4466-ae2f-3b68f74a0aad,difficult,1737737903770.0,1737738962712.0,1737739327763.0,1737739387154.0,1737742155277.0,1737742193602.0,1737739005687.0,1737742193604.0,The completion time and success rate,4,5,2,4,21,Male,['Black/African American'],Non-Hispanic,['none'],,,
fun-puzzles,fun-puzzles-exp1,production2,6790957096019241f9c4f69a,4091-dd377ff2-473f-452d-9abe-a2447b87041b,difficult,1737739627988.0,1737739732586.0,1737740180787.0,1737740231948.0,1737743100756.0,1737743137092.0,1737739818585.0,1737743137093.0,It was really difficult to figure it out but the game can improve concertation level ,4,5,0,2,49,Female,['Black/African American'],Prefer not to answer,['none'],,,
fun-puzzles,fun-puzzles-exp1,production2,6790957096019241f9c4f684,9330-ba53cf07-9a15-4ae5-931d-90e4b6d78589,enjoyable,1737737690920.0,1737738378706.0,1737740524923.0,1737740596536.0,1737743862848.0,1737743903225.0,1737738421762.0,1737743903226.0,it was tough,3,5,0,2,26,Female,['Black/African American'],Prefer not to answer,['none'],It was mentally challenged,,
fun-puzzles,fun-puzzles-exp1,production2,6790956f96019241f9c4f67f,8434-afec4833-f835-4abb-8008-d4d2a46783b0,enjoyable,1737737637868.0,1737737729737.0,1737737974384.0,1737738004071.0,1737745286781.0,1737745312654.0,1737737742768.0,1737745312654.0,The simplicity of it and ho user friendly it was,2,1,2,4,37,Male,['White'],Non-Hispanic,['Trackpad'],none,,
fun-puzzles,fun-puzzles-exp1,production2,6790957096019241f9c4f699,7955-21954200-59ed-4583-8e48-182d58899121,difficult,1737738714940.0,1737741806496.0,1737742773232.0,1737742876862.0,1737745668805.0,1737745707609.0,1737742305892.0,1737745707610.0,They were abit hard finding the gems took a bit longer,3,4,2,2,27,Female,['Black/African American'],Prefer not to answer,['Touch Screen'],,,
fun-puzzles,fun-puzzles-exp1,production2,6790956f96019241f9c4f67a,1890-81ac7e3a-a990-4e12-b54c-67a3c95550bd,enjoyable,1737737683876.0,1737737906800.0,1737740391435.0,1737740455475.0,1737747101595.0,1737747134182.0,1737737981413.0,1737747134183.0,It was very very tough. i tried my best.,4,5,1,1,26,Male,['Black/African American'],Non-Hispanic,['none'],I did not encounter any problem,,
fun-puzzles,fun-puzzles-exp1,production2,6790957096019241f9c4f69d,7424-35d570a4-ff0a-4a03-90f4-f092cdaaacd4,difficult,1737745482927.0,1737745572504.0,1737745876287.0,1737745913374.0,1737748219757.0,1737748248524.0,1737745591289.0,1737748248524.0,If i managed to solve them and thought process,5,5,1,3,30,Female,['White'],Non-Hispanic,['none'],,,
fun-puzzles,fun-puzzles-exp1,production2,6790957096019241f9c4f69c,1448-34a5ce1b-ff83-49f1-be14-374409a0736a,difficult,1737745273735.0,1737745545903.0,1737745870399.0,1737745924662.0,1737748633366.0,1737748665577.0,1737745588842.0,1737748665579.0,"Whether or not I could get any of the gems on to the beach - if I got none, i rated 10 - if I got 2, which is clearly the maximum number possible, as they were impossible to solve, I scored 9",5,5,1,0,39,Female,['White'],Non-Hispanic,['none'],It was incredibly frustrating when I discovered on the very first game that it was impossible to get all 3 gems on the beaches,,
fun-puzzles,fun-puzzles-exp1,production2,6790957196019241f9c4f6b8,8979-8f4a79ba-d6e6-4849-8b51-4a6c8dd83e79,difficult,1737751593330.0,1737751725879.0,1737752005473.0,1737752050670.0,1737753569295.0,1737753611507.0,1737751769958.0,1737753611508.0,"The more i reseted the puzzle, the higher difficulty rating i gave. The amount of time taken, but there were 1 or 2 puzzles that took long enough, however, when i completed them, i realised that they were not that hard, so i did not give a very high difficulty level.",4,5,1,3,18,Male,['White'],Non-Hispanic,['none'],"If possible, would be nice to fix the problem when i have to press with the mouse on the play area in order to use the keyboard arrows",,
fun-puzzles,fun-puzzles-exp1,production2,6790957096019241f9c4f6ac,0073-f83ee842-19f5-465a-b573-e5e1ecff0e2f,enjoyable,1737751560437.0,1737751649734.0,1737751924533.0,1737751973228.0,1737754386041.0,1737754412052.0,1737751698178.0,1737754412053.0,Mental challenge and success,4,5,0,1,42,Male,['White'],Hispanic,['Trackpad'],,,
fun-puzzles,fun-puzzles-exp1,production2,6790957096019241f9c4f6a2,5846-6d2c90f7-fb2a-414b-99bf-b7a1f46acbbd,enjoyable,1737751765489.0,1737751856491.0,1737752116269.0,1737752147584.0,1737754439702.0,1737754468133.0,1737751898579.0,1737754468133.0,They were very hard for me and I couldn't solve most of them so I scored them 1 if I couldn't complete them.,5,4,1,4,37,Female,['White'],Non-Hispanic,['none'],,,
fun-puzzles,fun-puzzles-exp1,production2,6790957096019241f9c4f6a1,2674-76bec893-9fbd-48b7-828b-b9c9de86842c,enjoyable,1737751527191.0,1737751610207.0,1737751837952.0,1737751867969.0,1737754522324.0,1737754549472.0,1737751648372.0,1737754549473.0,"I mainly based my rating on how easy it was to navigate the puzzles, however, none of them were easy to navigate. ",5,4,1,2,23,Female,['White'],Non-Hispanic,['Trackpad'],Maybe make the puzzles a bit easier!,,
fun-puzzles,fun-puzzles-exp1,production2,6790957196019241f9c4f6bd,4047-e32140a3-3b28-4f2b-9ba3-c2a1e9327ec6,difficult,1737751711688.0,1737751907783.0,1737752352226.0,1737752424851.0,1737754459326.0,1737754487714.0,1737751932326.0,1737754487715.0,"How easy it was to assume the puzzle was actually easy, THEN how many spaces around each piece were open to move it too for options to get each one in a spot without blocking a path!",4,5,0,2,43,Male,['White'],Non-Hispanic,"['Touch Screen', 'Trackpad']","Awesome job! They look easy, the most easy-looking ones sometimes being the most difficult! Amazing trick!!!! Love it!",,
fun-puzzles,fun-puzzles-exp1,production2,6790957196019241f9c4f6af,3417-e2d71d57-a14e-4886-a011-78e7d5243b0a,enjoyable,1737751560073.0,1737751643643.0,1737752159712.0,1737752221942.0,1737754629944.0,1737754655922.0,1737751676391.0,1737754655923.0,how much fun i had,5,5,0,2,23,Male,['Black/African American'],Hispanic,['none'],,,
fun-puzzles,fun-puzzles-exp1,production2,6790957196019241f9c4f6b3,2334-f3ce26dc-d7b8-4b11-9de4-693467aabb5a,difficult,1737751610712.0,1737751806662.0,1737752107191.0,1737752155446.0,1737754535017.0,1737754566831.0,1737751849353.0,1737754566832.0,The difficulty rating was based on how hard it was to get the gems to the beach tiles without getting stuck first. It was challenging as the turtle could only push the gems forward and not other directions. ,4,5,0,0,49,Female,['White'],Non-Hispanic,['none'],Thank you,,
fun-puzzles,fun-puzzles-exp1,production2,6790957096019241f9c4f6a3,7265-ac3cd1ef-b982-4f2e-af41-d56368ae6edf,enjoyable,1737751545301.0,1737751715772.0,1737752046709.0,1737752088624.0,1737754642885.0,1737754672966.0,1737751820915.0,1737754672966.0,Several seemed insoluble.,5,5,0,3,66,Male,['Multiracial/Mixed'],Prefer not to answer,['none'],,,
fun-puzzles,fun-puzzles-exp1,production2,6790957096019241f9c4f6a7,7311-a30685b7-505c-4139-9434-cff4b405d7c3,enjoyable,1737751563961.0,1737751701158.0,1737752023450.0,1737752074860.0,1737754731142.0,1737754760934.0,1737751780044.0,1737754760934.0,were these even possible?,5,5,0,3,59,Male,['White'],Non-Hispanic,['none'],no issue,,
fun-puzzles,fun-puzzles-exp1,production2,6790957196019241f9c4f6cd,5189-1145fda3-1f91-4ca5-9f29-db69268412b3,enjoyable,1737752692762.0,1737752720632.0,1737752907228.0,1737752933225.0,1737754851007.0,1737754876476.0,1737752737449.0,1737754876477.0,Whether or not the puzzle was solvable.,3,5,0,1,44,Female,['White'],Non-Hispanic,['none'],,,
fun-puzzles,fun-puzzles-exp1,production2,6790957096019241f9c4f6a0,0885-9d54908b-0065-4c7a-a372-20b29af57ac5,enjoyable,1737751633746.0,1737751771526.0,1737752159027.0,1737752208062.0,1737754787645.0,1737754819896.0,1737751836205.0,1737754819896.0,"How difficult the puzzle seemed to be, whether some are impossible from the very beginning and there is near none space to move any tiles. Those are rated worse I think.",3,5,1,4,25,Male,['White'],Non-Hispanic,['none'],No difficulties,,
fun-puzzles,fun-puzzles-exp1,production2,6790957096019241f9c4f6a6,0055-fdb3d639-30d2-43d6-a8b4-9c99d2c2e45e,enjoyable,1737751578414.0,1737751737945.0,1737752090658.0,1737752128784.0,1737754652818.0,1737754689966.0,1737751771373.0,1737754689966.0,"If it was a challenge/wasn't too easy, if I felt the game was addictive (couldn't stop trying to solve it)",2,5,0,2,36,Female,['White'],Non-Hispanic,['none'],"No technical difficulties, I really enjoyed the study!",,
fun-puzzles,fun-puzzles-exp1,production2,6790957196019241f9c4f6be,7570-7e21a10f-14c1-449e-b632-21b9a75d2f7b,difficult,1737751753490.0,1737751882779.0,1737752197537.0,1737752234481.0,1737754905100.0,1737754930224.0,1737751912208.0,1737754930225.0,They were unsolvable,5,5,0,3,51,Male,['White'],Non-Hispanic,['none'],,,
fun-puzzles,fun-puzzles-exp1,production2,6790957196019241f9c4f6b0,1806-1198a39d-5416-459a-b5bf-d805efb81190,enjoyable,1737751566205.0,1737751750293.0,1737752329853.0,1737752360668.0,1737754995803.0,1737755022163.0,1737752141510.0,1737755022173.0,"If the puzzle was too difficult and made me frustrated, then I rated it lower and vice versa",5,5,0,2,36,Female,['Multiracial/Mixed'],Non-Hispanic,['none'],No. Thank you! I tried my best!,,
fun-puzzles,fun-puzzles-exp1,production2,6790957096019241f9c4f6aa,7257-dc1e2b62-17ca-461f-855b-90b81c213649,enjoyable,1737751543218.0,1737751685681.0,1737751955098.0,1737751991941.0,1737754976662.0,1737755010581.0,1737751719551.0,1737755010582.0,Weather I could actually solve the puzzle how achievable a desired result actually was. ,4,5,0,1,54,Female,['White'],Hispanic,['none'],,,
fun-puzzles,fun-puzzles-exp1,production2,6790957096019241f9c4f6a5,3529-5cce2b4b-5b80-42cf-8af7-a1243bcef95b,enjoyable,1737751563783.0,1737751938389.0,1737752367083.0,1737752409875.0,1737755005513.0,1737755044848.0,1737751979016.0,1737755044849.0,its a mind tasking game,4,5,2,1,38,Male,['Black/African American'],Non-Hispanic,['Touch Screen'],nil,,
fun-puzzles,fun-puzzles-exp1,production2,6790957196019241f9c4f6b1,3368-10d99362-a076-4f79-937e-c720fdcbc414,enjoyable,1737751590054.0,1737751813468.0,1737752187725.0,1737752234081.0,1737754957718.0,1737755020912.0,1737751885939.0,1737755020912.0,"What affected my ratings was how enjoyable the puzzle, that is how easy i found it to complete and also the fun I had thinking about a solution.",3,5,1,2,30,Male,['White'],Non-Hispanic,['Trackpad'],No please,,
fun-puzzles,fun-puzzles-exp1,production2,6790957196019241f9c4f6b9,1064-892ec835-62f9-4338-82b9-5d4180f39f88,difficult,1737751671307.0,1737752008650.0,1737752372829.0,1737752422004.0,1737755239744.0,1737755281330.0,1737752101035.0,1737755281331.0,How many of the pebbles I got on to the sand,5,5,0,0,60,Female,['White'],Non-Hispanic,['Trackpad'],,,
fun-puzzles,fun-puzzles-exp1,production2,6790957196019241f9c4f6ca,2485-47f57e30-a80b-4dbd-a9e6-6b306a349c3f,enjoyable,1737752507375.0,1737752658516.0,1737752982519.0,1737753018437.0,1737755404448.0,1737755447347.0,1737752706289.0,1737755447348.0,MY PERFORMANCE IN THE PUZZLES,3,5,0,3,34,Male,['Black/African American'],Non-Hispanic,['none'],,,
fun-puzzles,fun-puzzles-exp1,production2,6790957096019241f9c4f6a8,3923-9e1c2464-4cd8-4845-a0d6-2816d7461393,enjoyable,1737751554423.0,1737751899333.0,1737752295586.0,1737752366493.0,1737755349486.0,1737755390862.0,1737751972828.0,1737755390871.0,3 difficult,5,5,1,1,35,Female,['Black/African American'],Non-Hispanic,['Trackpad'],none,,
